{
  "format": "dubsar.my-work-mission-automation-results/1",
  "availability": "available",
  "mission": {
    "project_id": "project-fixture",
    "mission_id": "mission:automation-001",
    "ticket_id": "DUB-901",
    "work_id": "mission:automation-001"
  },
  "runs": [
    {
      "automation_run_id": "run_00000001",
      "mission_ref": "mission:automation-001",
      "mission_binding_method": "work_id",
      "launch_request_id": "launch_00000001",
      "request_digest": "85be2b3e50e5470df42835cdda142340b82f090d58cb2faba0f5ed12c599d380",
      "source_record_digest": "7777777777777777777777777777777777777777777777777777777777777777",
      "workflow": {
        "ref": "workflow:github-issues",
        "version": "1.0.0",
        "digest": "9abf7822ebc3b19280e26bb9dc55da452a7c01d22ef5778b2d2359135670319f",
        "digest_scheme": "dubsar.automation.workflow.v1"
      },
      "step_identity": {
        "step_id": "step_00000001",
        "step_instance_id": "stepinst_00000001",
        "execution_id": "exec_00000001",
        "request_digest": "97caa0a40fa711dcc7033fd6322d0fb6ed5a8e5f355aec18f1023ef23b06df25"
      },
      "native_binding": null,
      "recorded_state": "succeeded",
      "completion": "recorded_terminal",
      "result_evidence": {
        "status": "documented",
        "event_id": "event_00000001",
        "event_digest": "311646942ee025b86e9d0639687e784f95af372005e16f0d5513d3d999ec1b0b"
      },
      "recorded_times": {
        "created_at": "2026-09-28T10:00:00.000Z",
        "updated_at": "2026-09-28T10:00:30.000Z",
        "launch_committed_at": "2026-09-28T10:00:00.000Z"
      },
      "events": [
        {
          "event": {
            "contract": "dubsar.automation.run-event/1",
            "event_id": "event_00000001",
            "event_sequence": 2,
            "mission_ref": "mission:automation-001",
            "automation_run_id": "run_00000001",
            "workflow_digest": "9abf7822ebc3b19280e26bb9dc55da452a7c01d22ef5778b2d2359135670319f",
            "request_digest": "85be2b3e50e5470df42835cdda142340b82f090d58cb2faba0f5ed12c599d380",
            "occurred_at": "2026-09-28T10:00:30.000Z",
            "event_type": "terminal",
            "run_state": "succeeded",
            "native_run_state": "FINISHED",
            "steps": [
              {
                "step_id": "step_00000001",
                "step_instance_id": "stepinst_00000001",
                "execution_id": "exec_00000001",
                "native_step_state": "SUCCEEDED",
                "transport_state": "response_received",
                "tool_status": "succeeded",
                "tool_receipt_ref": "artifact:receipt-001",
                "tool_receipt_digest": "9e85aa95f04db5f108534e48b63e75e8045a7ecab59988405e70a9260300a0d6",
                "remote_durable": true,
                "provider_dispatch_count": 1,
                "retry_allowed": false
              }
            ],
            "evidence_refs": []
          },
          "event_digest": "311646942ee025b86e9d0639687e784f95af372005e16f0d5513d3d999ec1b0b",
          "received_at": "2026-09-28T19:00:01.000Z",
          "reference_contents_read": false,
          "reference_availability": "not_checked"
        }
      ],
      "omitted_event_count": 0,
      "limits": []
    }
  ],
  "source_snapshots": {
    "mission_registry": {
      "digest": "8888888888888888888888888888888888888888888888888888888888888888",
      "digest_scheme": "sha256/stable-json",
      "availability": "read"
    },
    "automation_registry": {
      "digest": "9999999999999999999999999999999999999999999999999999999999999999",
      "digest_scheme": "sha256/file-bytes",
      "availability": "read"
    },
    "automation_marker": {
      "digest": null,
      "digest_scheme": "sha256/file-bytes",
      "availability": "not_applicable"
    },
    "atomic": false
  },
  "omissions": {
    "runs": 0,
    "events": 0,
    "events_in_omitted_runs": 0,
    "unbound_project_runs": 0,
    "ambiguous_project_runs": 0
  },
  "truncated": false,
  "limits": [],
  "mission_criteria": "not_evaluated",
  "authority": "none",
  "executable": false
}
